{

  "schema_version": 1,
  "id": "proposal-scar-tissue-base",
  "idea_id": "idea-scar-tissue",
  "track": "behavior",
  "state": "approved",
  "question": "Can oriented path memory produce reinforcement, saturation, abandonment, and regrowth without scripted composition?",
  "mechanism": "Agents deposit an oriented field. Weak traces attract or align motion, saturated traces repel it, and idle traces decay.",
  "outputs": ["agent-state", "field-state", "transition", "diagnostic-loop", "metrics", "hip"],
  "stop_conditions": ["no reinforced cells", "no saturated cells", "behaviour remains illegible in a sharp instrument view"],
  "runner": "behavior.scar_tissue_probe",
  "cost_tier": "probe",
  "visibility": "private"
}
