{
  "cost_tier": "study",
  "direction_ids": [
    "direction-fbe9c254e174"
  ],
  "extensions": {
    "bzor.systems/explicit-user-approval": "KC selected the controlled identity ladder diagnostic."
  },
  "hypothesis": "Exact Mulberry32 graph/event replay will recover Canvas morphology in planar VEX; adding only shallow deterministic Z will isolate dimensional change without reseeding.",
  "id": "proposal-35f89d503a5b",
  "idea_id": "idea-nonlocal-affinity-dance-b774404e",
  "mechanism": "Recreate each 5k Canvas initial state and event schedule exactly; replay it in planar VEX; preserve XY, graph, and events while adding bounded Z depth 0.15 for a second VEX replay.",
  "outputs": [
    "three exact planar VEX replays",
    "three graph-identical shallow-3D replays",
    "30fps all-point comparisons",
    "parity and receipt manifest"
  ],
  "question": "Where does Canvas morphology diverge: runtime handoff or the controlled 2D-to-3D lift?",
  "runner": "behavior.nonlocal_affinity_3d",
  "schema_version": 1,
  "state": "approved",
  "stop_conditions": [
    "Canvas oracle mismatch",
    "relationship mismatch",
    "VEX error",
    "reference tolerance failure",
    "non-finite geometry"
  ],
  "track": "behavior",
  "visibility": "private"
}
